The Shawshank Redemption,G,NOWSHOWING,Andy Dufresne (Tim Robbins) is sentenced to two consecutive life terms in prison for the murders of his wife and her lover and is sentenced to a tough prison. However. only Andy knows he didn't commit the crimes. ,Frank Darabont,4.17,12/12/2022,Morgan Freeman; Tim Robbins,65.5,2D
The Godfather I,PG,NOWSHOWING,After getting in a car accident. a woman is held in a shelter with two men who claim the outside world is affected by a widespread chemical attack.,Francis Ford Coppola,4.33,12/12/2022,Al Pacino; Marlon Brando,142.4,Blockbuster
Schindler's List,NC16,NOWSHOWING,Businessman Oskar Schindler (Liam Neeson) arrives in Krakow in 1939. ready to make his fortune from World War II. which has just started.,Steven Spielberg,4.25,12/12/2022,Liam Neeson; Ralph Fiennes,62,Blockbuster
The Lord of the Rings: The Return of the King,G,NOWSHOWING,The culmination of nearly 10 years' work and conclusion to Peter Jackson's epic trilogy based on the timeless J.R.R.,Peter Jackson,4.5,15/12/2022,Elijah Wood; Karl Urban,66.5,2D
The Dark Knight II,M18,COMMINGSOON,With the help of allies Lt. Jim Gordon (Gary Oldman) and DA Harvey Dent (Aaron Eckhart). Batman (Christian Bale) has been able to keep a tight lid on crime in Gotham City.,Christopher Nolan,NA,20/12/2022,Christian Bale; Heath Ledger,NA,3D
All Quiet on the Western Front,G,PREVIEW,All Quiet on the Western Front tells the story of a group of young Germans who enlist in World War I after being captivated by slogans of patriotism and honour.,Edward Berger,3.75,19/12/2022,Felix Kammerer; Daniel Brühl,31,3D
The Godfather II,R21,COMMINGSOON,"The compelling sequel to ""The Godfather"" contrasting the life of Corleone father and son.",Francis Ford Coppola,NA,20/12/2022,Robert De Niro; James Caan,0,IMAX
The Dark Knight I,PG,ENDOFSHOWING,With the help of allies Lt. Jim Gordon (Gary Oldman) and DA Harvey Dent (Aaron Eckhart). Batman (Christian Bale) has been able to keep a tight lid on crime in Gotham City.,Christopher Nolan,4.33,10/11/2022,Christian Bale; Heath Ledger,93,IMAX